{
  "$schema": "../../../schemas/fixture.schema.json",
  "schemaVersion": 1,
  "id": "atm11-0.2.1",
  "source": {
    "kind": "curseforge-client-pack",
    "projectId": 1148445,
    "fileId": 8431787,
    "pageUrl": "https://www.curseforge.com/minecraft/modpacks/all-the-mods-11/files/8431787",
    "downloadUrl": "https://mediafilez.forgecdn.net/files/8431/787/All%20the%20Mods%2011-0.2.1.zip",
    "termsUrl": "https://support.curseforge.com/en/support/solutions/articles/9000207877-terms-conditions",
    "fileName": "atm11-0.2.1.zip",
    "sha256": "c931db298c22643c8bd13c1e452323a34828d9410dad6c8b6002033111ac5d50"
  },
  "manifest": {
    "entry": "manifest.json",
    "sha256": "7e5ef9696d85279ce669082f019f0f40a95f4012e9c27b1fc572333d0dd5d3ac",
    "manifestType": "minecraftModpack",
    "manifestVersion": 1,
    "name": "All the Mods 11",
    "version": "0.2.1",
    "author": "ATMTeam",
    "minecraft": "26.1.2",
    "modLoader": "neoforge-26.1.2.78",
    "expectedReferenceCount": 235
  }
}
